{
  "format": "arachne_batch",
  "batch_id": "research-00421",
  "create": {
    "concepts": [
      {"local_id": "concept-light-art", "concept_type": "movement", "slug": "light-art"},
      {"local_id": "concept-immersive-space", "concept_type": "theme", "slug": "immersive-space"}
    ],
    "names": [
      {"entity_id": "concept-light-art", "name_type": "english", "language_code": "en", "value": "Light art", "is_preferred": true},
      {"entity_id": "concept-immersive-space", "name_type": "english", "language_code": "en", "value": "Immersive space", "is_preferred": true}
    ],
    "sources": [
      {
        "local_id": "source-catalogue",
        "source_type": "catalogue",
        "title": "Luminous Field: Exhibition Catalogue",
        "bibliography_text": "Museum Example. Luminous Field: Exhibition Catalogue. 2024.",
        "publisher": "Museum Example",
        "publication_date": "2024",
        "language_code": "en"
      }
    ],
    "evidence": [
      {
        "local_id": "evidence-light-art",
        "source_id": "source-catalogue",
        "exact_quote": "The installation uses light to transform the viewer's perception of the room.",
        "quote_language": "en",
        "locator_json": "{\"page\":42}",
        "stance": "supports"
      }
    ],
    "work_concepts": [
      {
        "local_id": "assertion-work-light-art",
        "work_id": "work-000321",
        "concept_id": "concept-light-art",
        "relation_type": "exemplifies",
        "centrality": 95,
        "centrality_scale": "graded",
        "historical_role": "canonical",
        "confidence": 0.9,
        "evidence": ["evidence-light-art"]
      }
    ],
    "concept_relations": [
      {
        "local_id": "assertion-concept-space",
        "subject_concept_id": "concept-light-art",
        "relation_type": "influenced_by",
        "object_concept_id": "concept-immersive-space",
        "strength": 70,
        "confidence": 0.75,
        "evidence": ["evidence-light-art"]
      }
    ],
    "parent_guide_assertions": [
      {
        "local_id": "assertion-parent-guide",
        "work_id": "work-000321",
        "concept_id": "concept-immersive-space",
        "category": "frightening",
        "intensity": 1,
        "explicitness": 1,
        "frequency": 1,
        "centrality": 1,
        "realism": 1,
        "spoiler_level": "none",
        "confidence": 0.6,
        "evidence": ["evidence-light-art"]
      }
    ]
  },
  "update": {
    "provider_ids": [
      {
        "entity_id": "work-000321",
        "provider": "wikidata",
        "old_external_id": "Q100",
        "new_external_id": "Q101"
      }
    ],
    "sources": [
      {"id": 42, "set": {"title": "Corrected source title"}, "unset": ["author_text"]}
    ],
    "work_concepts": [
      {"id": 73, "set": {"centrality": 80, "centrality_scale": "ordinal"}, "unset": []}
    ],
    "delete": {
      "evidence": [90],
      "work_concepts": [91],
      "concept_relations": [92],
      "parent_guide_assertions": [93]
    }
  },
  "merge": {
    "concepts": [
      {
        "target": "concept-000172",
        "members": ["concept-000173"],
        "set": {"concept_type": "movement", "slug": "light-art"},
        "unset": []
      }
    ]
  }
}
